"Issue Category Name","Description"
"Electronic Health Records (EHR) Issues","Problems related to the hospital's digital patient record system."
"Hardware Issues","Problems related to physical computer devices and hospital IT hardware."
"Biomedical Device Issue","Faults or malfunctions in medical equipment used for patient care and diagnostics."
"Networking Issue","Problems affecting internet connectivity, internal network, and communication across the hospital."
"System Issue","Issues related to software applications, hospital management systems, and digital records."
